{
  "version": "2.1.0",
  "lastUpdated": "2026-09-07",
  "distroCount": 57,
  "distros": {
    "ubuntu": {
      "name": "Ubuntu", "tagline": "The gateway to Linux", "color": "#E95420", "icon": "🟠", "difficulty": 1,
      "description": "The most popular desktop Linux distribution. Massive community, commercial support from Canonical, and the widest software compatibility of any distro. Ubuntu 26.04.1 LTS 'Resolute Raccoon' (August 27, 2026) is the current install image, with GNOME 50 on Wayland, kernel 7.0, Rust-based core utilities, and TPM-backed full-disk encryption. Supported through May 2031 (2036 with Pro).",
      "desktop": ["GNOME"], "packageManager": "APT (deb) + Snap", "releaseModel": "Fixed (6-month, LTS every 2 years)", "basedOn": "debian", "initSystem": "systemd",
      "website": "https://ubuntu.com",
      "pros": ["Largest community and documentation", "Widest software and hardware compatibility", "Long-term support (5+ years with ESM)", "Excellent cloud and server integration"],
      "cons": ["Snap packages can be slow to launch", "GNOME is resource-heavy", "Canonical's commercial priorities sometimes conflict with community"],
      "traits": { "beginner": 10, "gaming": 7, "privacy": 5, "dev": 7, "server": 8, "light": 3, "custom": 5, "stable": 8, "latest": 5 },
      "categories": ["beginner", "desktop", "server", "enterprise", "developer"],
      "nvidiaSupport": "good", "immutable": false, "yearFounded": 2004
    },
    "mint": {
      "name": "Linux Mint", "tagline": "Elegant & comfortable", "color": "#87CF3E", "icon": "🟢", "difficulty": 1,
      "description": "The most Windows-like Linux experience. Ships Cinnamon desktop with no Snaps, excellent out-of-the-box usability, and rock-solid Ubuntu LTS base. Mint 22.3 'Zena' is current, refreshed with HWE ISOs on kernel 7.0 in August 2026. Mint 23 — Ubuntu 26.04-based, with Cinnamon on Wayland and LMDE's installer — is due December 2026.",
      "desktop": ["Cinnamon", "MATE", "Xfce"], "packageManager": "APT (deb) + Flatpak", "releaseModel": "Fixed (follows Ubuntu LTS)", "basedOn": "ubuntu", "initSystem": "systemd",
      "website": "https://linuxmint.com",
      "pros": ["Most familiar experience for Windows users", "No Snap packages", "Excellent built-in tools (Timeshift, Update Manager)", "Stable Ubuntu LTS base"],
      "cons": ["Slower to receive newest software", "Smaller community than Ubuntu", "Not suitable for server use"],
      "traits": { "beginner": 10, "gaming": 7, "privacy": 6, "dev": 6, "server": 3, "light": 5, "custom": 6, "stable": 9, "latest": 3 },
      "categories": ["beginner", "desktop"],
      "nvidiaSupport": "good", "immutable": false, "yearFounded": 2006
    },
    "lmde": {
      "name": "LMDE", "tagline": "Mint, directly on Debian", "color": "#6BBD45", "icon": "🟢", "difficulty": 2,
      "description": "Linux Mint Debian Edition — the same Mint experience built directly on Debian Stable instead of Ubuntu. LMDE 7 'Gigi' (October 2025) is based on Debian 13 'Trixie' with kernel 6.12 LTS. Insurance policy for the Mint project and a great choice for Debian fans who want Cinnamon.",
      "desktop": ["Cinnamon"], "packageManager": "APT (deb)", "releaseModel": "Fixed (follows Debian Stable)", "basedOn": "debian", "initSystem": "systemd",
      "website": "https://linuxmint.com/download_lmde.php",
      "pros": ["Pure Debian base without Ubuntu layer", "Same Mint tools and Cinnamon experience", "Longer support cycle than Ubuntu-based Mint", "No Snaps, no Ubuntu dependencies"],
      "cons": ["Cinnamon only (no MATE/Xfce editions)", "Older packages than Ubuntu-based Mint", "Smaller community and fewer guides"],
      "traits": { "beginner": 8, "gaming": 5, "privacy": 6, "dev": 6, "server": 3, "light": 5, "custom": 5, "stable": 9, "latest": 2 },
      "categories": ["beginner", "desktop"],
      "nvidiaSupport": "good", "immutable": false, "yearFounded": 2010
    },
    "fedora": {
      "name": "Fedora", "tagline": "Leading-edge innovation", "color": "#51A2DA", "icon": "🔵", "difficulty": 2,
      "description": "Red Hat's community distribution and the proving ground for RHEL technologies. Fedora 44 (April 28, 2026) ships GNOME 50, KDE Plasma 6.6, GCC 16, Python 3.14, and the NTSYNC kernel module for Wine and Steam; it is supported until June 2027. Fedora 45 is targeted for October 20, 2026.",
      "desktop": ["GNOME", "KDE", "Xfce", "Sway", "Budgie"], "packageManager": "DNF 5 (rpm) + Flatpak", "releaseModel": "Fixed (6-month cycles)", "basedOn": "independent", "initSystem": "systemd",
      "website": "https://fedoraproject.org",
      "pros": ["Latest stable software without rolling risk", "Excellent GNOME and KDE spins", "Strong security defaults (SELinux)", "DNF 5 is significantly faster"],
      "cons": ["Short support cycle (13 months per release)", "No proprietary codecs out of the box", "Smaller repos than Debian/Ubuntu"],
      "traits": { "beginner": 6, "gaming": 6, "privacy": 7, "dev": 9, "server": 6, "light": 4, "custom": 5, "stable": 7, "latest": 8 },
      "categories": ["desktop", "developer"],
      "nvidiaSupport": "good", "immutable": false, "yearFounded": 2003
    },
    "fedora_silverblue": {
      "name": "Fedora Silverblue", "tagline": "Immutable Fedora with GNOME", "color": "#3C6EB4", "icon": "🔷", "difficulty": 3,
      "description": "Fedora's immutable desktop variant using OSTree. The base system is read-only with atomic updates and rollbacks. Apps are installed via Flatpak or toolbox containers. Silverblue 44 (April 28, 2026) ships GNOME 50; Fedora 45 in October 2026 brings a web-based installer to the Atomic desktops.",
      "desktop": ["GNOME"], "packageManager": "rpm-ostree + Flatpak", "releaseModel": "Fixed (follows Fedora)", "basedOn": "fedora", "initSystem": "systemd",
      "website": "https://fedoraproject.org/atomic-desktops/silverblue/",
      "pros": ["Atomic updates with instant rollback", "Rock-solid base system", "Flatpak-first app model", "Same Fedora release cadence"],
      "cons": ["Can't easily install traditional RPMs", "Steeper learning curve for package management", "Toolbox/Distrobox needed for dev work"],
      "traits": { "beginner": 4, "gaming": 5, "privacy": 7, "dev": 7, "server": 3, "light": 4, "custom": 4, "stable": 9, "latest": 8 },
      "categories": ["desktop", "developer", "immutable"],
      "nvidiaSupport": "good", "immutable": true, "yearFounded": 2018
    },
    "arch": {
      "name": "Arch Linux", "tagline": "Keep it simple, build it yourself", "color": "#1793D1", "icon": "🏔️", "difficulty": 4,
      "description": "A rolling-release distribution with a minimal base. You build your system from scratch using pacman and the AUR — roughly 15,800 official packages and 49,000+ AUR build scripts. The Arch Wiki is the best documentation in all of Linux. The 2026.09.01 install ISO ships kernel 7.2.2 and Archinstall 4.4.",
      "desktop": ["Any (you choose)"], "packageManager": "Pacman + AUR", "releaseModel": "Rolling", "basedOn": "independent", "initSystem": "systemd",
      "website": "https://archlinux.org",
      "pros": ["Always up-to-date packages", "AUR has virtually everything", "Legendary Arch Wiki", "Total system control"],
      "cons": ["Manual installation (archinstall helps)", "Can break with updates", "Steep learning curve", "Requires ongoing maintenance"],
      "traits": { "beginner": 1, "gaming": 8, "privacy": 7, "dev": 9, "server": 4, "light": 8, "custom": 10, "stable": 5, "latest": 10 },
      "categories": ["advanced", "developer", "desktop"],
      "nvidiaSupport": "good", "immutable": false, "yearFounded": 2002
    },
    "debian": {
      "name": "Debian", "tagline": "The universal operating system", "color": "#A80030", "icon": "🔴", "difficulty": 3,
      "description": "The grandfather of Ubuntu, Mint, and hundreds of derivatives. Famous for rock-solid stability and 69,000+ packages. Debian 13 'Trixie' (August 2025; point release 13.6 on July 11, 2026) is the active stable, with full support to August 2028 and LTS through June 2030.",
      "desktop": ["GNOME", "KDE", "Xfce", "MATE", "LXQt", "Cinnamon"], "packageManager": "APT (deb)", "releaseModel": "Fixed (2-year cycles)", "basedOn": "independent", "initSystem": "systemd",
      "website": "https://debian.org",
      "pros": ["Legendary stability", "Massive 60,000+ package repository", "Strong free software commitment", "The backbone of countless servers"],
      "cons": ["Older software versions in Stable", "Installer less polished than Ubuntu", "Hardware support can lag behind"],
      "traits": { "beginner": 4, "gaming": 4, "privacy": 7, "dev": 7, "server": 10, "light": 6, "custom": 7, "stable": 10, "latest": 2 },
      "categories": ["server", "developer", "advanced"],
      "nvidiaSupport": "fair", "immutable": false, "yearFounded": 1993
    },
    "opensuse": {
      "name": "openSUSE", "tagline": "Choose your adventure", "color": "#73BA25", "icon": "🦎", "difficulty": 2,
      "description": "Two flavors: Tumbleweed (rolling) and Leap 16.0 (October 2025), with Leap 16.1 due November 3, 2026. Leap 16 replaced the YaST installer with Agama, requires x86-64-v2, and keeps Btrfs snapshots by default. Strong enterprise heritage from SUSE, with a migration path to SLES.",
      "desktop": ["KDE", "GNOME", "Xfce"], "packageManager": "Zypper (rpm)", "releaseModel": "Rolling (Tumbleweed) or Fixed (Leap)", "basedOn": "independent", "initSystem": "systemd",
      "website": "https://opensuse.org",
      "pros": ["Modern Agama installer, shared with SUSE Enterprise", "Choice of rolling or stable", "Excellent KDE implementation", "Btrfs snapshots with Snapper by default"],
      "cons": ["Smaller community than Debian/Ubuntu", "Fewer tutorials available", "Package naming conventions can confuse"],
      "traits": { "beginner": 5, "gaming": 5, "privacy": 6, "dev": 8, "server": 8, "light": 4, "custom": 7, "stable": 8, "latest": 7 },
      "categories": ["desktop", "developer", "server"],